<?xml version="1.0" encoding="UTF-8"?>
<!DOCTYPE folder SYSTEM "folder.dtd">
<folder>
    <toc>
        <entries>
            <entry name="" displayName="Community Support"/>
            <entry name="#plugins" displayName="IDE Plugins"/>
            <entry name="#samples" displayName="Samples"/>
            <entry name="#release-notes" displayName="Release notes"/>
            <entry name="#migration-guides" displayName="Migration Guides">
                <entry name="Migrating-from-07-to-10" title="Migrating from v. 0.7 to 1.0"
                        displayName="Migrating from v. 0.7 to 1.0"/>
                <entry name="Migrating-from-11-to-12" title="Migrating from v. 1.1 to 1.2"
                        displayName="Migrating from v. 1.1 to 1.2"/>
                <entry name="Migrating-from-13-to-14" title="Migrating from v. 1.3 to 1.4"
                        displayName="Migrating from v. 1.3 to 1.4"/>
            </entry>
        </entries>
    </toc>
</folder>
