<?xml version="1.0" encoding="UTF-8"?>
<!DOCTYPE folder SYSTEM "folder.dtd">
<folder title="GWTP" displayName="GWTP" style="gwtp">
    <toc>
        <entries>
            <entry name="index" displayName="Overview"/>
            <entry name="tutorials/" displayName="Beginner's Tutorial"/>
            <entry name="get-started/" displayName="Get Started"/>
            <entry name="core/" displayName="Core (MVP)"/>
            <entry name="advanced/" displayName="Advanced Features"/>
            <entry name="communication/" displayName="Communication"/>
            <entry name="tools/" displayName="Tools and Patterns"/>
            <entry name="resources/" displayName="Resources"/>
            <entry name="contributing/" displayName="Contributing"/>
            <entry name="License" displayName="License"/>
        </entries>
    </toc>
</folder>
